{
  "schemaVersion": "2.0",
  "appName": "scgis-portal-spa",
  "displayName": "SCGIS Wales Portal SPA",
  "environment": "dev",
  "businessUnit": "PLATFORM",
  "changeTicket": "CHG000001",
  "owner": {
    "groupObjectId": "00000000-0000-0000-0000-000000000000",
    "primaryContact": "dejan.gregor@gmail.com"
  },
  "tags": {
    "data-classification": "public",
    "environment": "dev"
  },
  "signInAudience": "AzureADMyOrg",
  "tokenVersion": 2,
  "platforms": {
    "spa": {
      "enabled": true,
      "redirectUris": [
        "https://portal.dev.scgis.example/auth/callback",
        "http://localhost:3000/auth/callback"
      ]
    },
    "web": {
      "enabled": false,
      "redirectUris": [],
      "implicitGrant": {
        "accessToken": false,
        "idToken": false
      }
    },
    "publicClient": {
      "enabled": false,
      "redirectUris": []
    }
  },
  "exposedApi": {
    "enabled": false,
    "scopes": [],
    "appRoles": []
  },
  "requiredPermissions": [
    {
      "resource": "MicrosoftGraph",
      "delegated": ["User.Read", "openid", "profile", "offline_access"],
      "application": []
    }
  ],
  "optionalClaims": {
    "idToken": [
      {"name": "groups", "essential": false}
    ]
  },
  "groupMembershipClaims": "SecurityGroup"
}
